Biggest Gains,Price,% Gain,Biggest Losses,Price؜,% Loss
"PYPL, PayPal Holdings Inc",205.42,1.42%,"TSLA, Tesla Inc",1023.5,-0.73%
"BKR, Baker Hughes Co",25.28,0.86%,"AES, The AES Corp",23.89,-0.62%
"MOS, The Mosaic Co",37.52,0.83%,"NI, NiSource Inc",25.03,-0.56%
"ENPH, Enphase Energy Inc",239.39,0.81%,"FMC, FMC Corp",106.99,-0.43%
"ZTS, Zoetis Inc",220.2,0.78%,"D, Dominion Energy Inc",74.58,-0.42%
"XLNX, Xilinx Inc",205.0,0.71%,"ANET, Arista Networks Inc",531.36,-0.40%
"IDXX, IDEXX Laboratories Inc",629.26,0.69%,"SRE, Sempra Energy",125.06,-0.40%
"LUV, Southwest Airlines Co",50.91,0.68%,"VFC, VF Corp",75.18,-0.40%
