Biggest Gains,Price,% Gain,Biggest Losses,Price؜,% Loss
"ENPH, Enphase Energy Inc",140.47,13.41%,"LHX, L3Harris Technologies Inc",209.29,-4.29%
"NFLX, Netflix Inc",427.14,11.13%,"K, Kellogg Co",63.0,-3.46%
"TSLA, Tesla Inc",936.72,10.68%,"CTXS, Citrix Systems Inc",101.94,-3.42%
"XLNX, Xilinx Inc",193.55,8.77%,"CF, CF Industries Holdings Inc",68.87,-3.14%
"MPWR, Monolithic Power Systems Inc",402.93,8.64%,"PFE, Pfizer Inc",52.69,-3.02%
"AMD, Advanced Micro Devices Inc",114.25,8.56%,"NOC, Northrop Grumman Corp",369.9,-2.71%
"NXPI, NXP Semiconductors NV",205.44,8.44%,"REGN, Regeneron Pharmaceuticals Inc",608.59,-2.61%
"NEE, NextEra Energy Inc",78.12,7.75%,"CVS, CVS Health Corp",106.51,-2.53%
