Biggest Gains,Price,% Gain,Biggest Losses,Price؜,% Loss
"CCL, Carnival Corp",18.9,3.39%,"PFG, Principal Financial Group Inc",66.92,-6.59%
"PFE, Pfizer Inc",61.02,2.59%,"MRNA, Moderna Inc",276.38,-6.25%
"AAL, American Airlines Group Inc",17.3,2.06%,"NUE, Nucor Corp",111.13,-5.82%
"NCLH, Norwegian Cruise Line Holdings Ltd",20.74,2.02%,"DISH, DISH Network Corp",31.35,-5.71%
"DVA, DaVita Inc",106.93,1.96%,"ENPH, Enphase Energy Inc",178.73,-5.49%
"EXPE, Expedia Group Inc",162.43,1.96%,"NWL, Newell Brands Inc",20.57,-5.43%
"EA, Electronic Arts Inc",129.92,1.88%,"RL, Ralph Lauren Corp",108.9,-5.35%
"LW, Lamb Weston Holdings Inc",59.05,1.74%,"SYF, Synchrony Financial",44.22,-5.21%
