Biggest Gains,Price,% Gain,Biggest Losses,Price؜,% Loss
"SIVB, SVB Financial Group",733.29,7.53%,"HUM, Humana Inc",367.53,-19.37%
"LW, Lamb Weston Holdings Inc",67.82,7.45%,"BBWI, Bath & Body Works Inc",62.34,-6.40%
"CFG, Citizens Financial Group Inc",53.8,5.53%,"NUE, Nucor Corp",116.6,-4.99%
"HES, Hess Corp",85.25,5.47%,"ACN, Accenture PLC",378.0,-4.83%
"KEY, KeyCorp",25.93,5.11%,"NEE, NextEra Energy Inc",85.77,-4.41%
"RF, Regions Financial Corp",24.59,4.86%,"CNC, Centene Corp",76.34,-4.32%
"MRO, Marathon Oil Corp",18.03,4.76%,"TTWO, Take-Two Interactive Software Inc",164.61,-4.21%
"FANG, Diamondback Energy Inc",123.65,4.69%,"ANTM, Anthem Inc",439.45,-4.10%
