Biggest Gains,Price,% Gain,Biggest Losses,Price؜,% Loss
"APA, APA Corp",27.97,7.29%,"CTXS, Citrix Systems Inc",95.15,-2.79%
"DVN, Devon Energy Corp",44.61,6.09%,"LVS, Las Vegas Sands Corp",37.87,-1.87%
"FANG, Diamondback Energy Inc",111.14,4.91%,"WYNN, Wynn Resorts Ltd",87.58,-1.46%
"RL, Ralph Lauren Corp",116.93,4.27%,"MRNA, Moderna Inc",246.88,-1.24%
"EOG, EOG Resources Inc",90.78,4.13%,"MGM, MGM Resorts International",45.21,-1.16%
"ZBRA, Zebra Technologies Corp",606.33,4.11%,"PENN, Penn National Gaming Inc",50.81,-1.15%
"LRCX, Lam Research Corp",723.4,3.53%,"DAL, Delta Air Lines Inc",39.0,-0.76%
"MRO, Marathon Oil Corp",16.56,3.50%,"ALK, Alaska Air Group Inc",52.62,-0.75%
