Biggest Gains,Price,% Gain,Biggest Losses,Price؜,% Loss
"AXP, American Express Co",172.96,8.69%,"NEE, NextEra Energy Inc",75.1,-8.33%
"APA, APA Corp",33.07,8.28%,"MPWR, Monolithic Power Systems Inc",374.87,-6.75%
"OXY, Occidental Petroleum Corp",36.77,8.12%,"PAYC, Paycom Software Inc",304.82,-6.70%
"HAL, Halliburton Co",30.59,7.00%,"XLNX, Xilinx Inc",173.16,-6.66%
"MRO, Marathon Oil Corp",19.5,6.56%,"CDAY, Ceridian HCM Holding Inc",72.55,-6.57%
"FANG, Diamondback Energy Inc",126.98,6.33%,"IDXX, IDEXX Laboratories Inc",478.19,-6.54%
"DVN, Devon Energy Corp",51.26,6.06%,"TER, Teradyne Inc",138.29,-6.21%
"SLB, Schlumberger Ltd",38.79,5.98%,"CDNS, Cadence Design Systems Inc",142.39,-6.11%
