Biggest Gains,Price,% Gain,Biggest Losses,Price؜,% Loss
"TSLA, Tesla Inc",1208.92,8.52%,"FTNT, Fortinet Inc",324.11,-3.64%
"ALGN, Align Technology Inc",661.46,5.94%,"ROL, Rollins Inc",34.2,-2.92%
"LVS, Las Vegas Sands Corp",41.02,5.69%,"ETSY, Etsy Inc",243.62,-2.82%
"ABMD, Abiomed Inc",349.99,5.41%,"INTU, Intuit Inc",608.81,-2.74%
"DVN, Devon Energy Corp",41.99,4.77%,"CBRE, CBRE Group Inc",101.23,-2.74%
"PENN, Penn National Gaming Inc",74.89,4.59%,"MTD, Mettler-Toledo International Inc",1444.44,-2.46%
"RCL, Royal Caribbean Group",88.28,4.56%,"SPGI, S&P Global Inc",463.18,-2.32%
"NLSN, Nielsen Holdings PLC",21.16,4.49%,"NOW, ServiceNow Inc",682.3,-2.22%
