Biggest Gains,Price,% Gain,Biggest Losses,Price؜,% Loss
"NCLH, Norwegian Cruise Line Holdings",13.93,8.40%,"AAP, Advance Auto Parts",179.91000000000003,-9.62%
"ILMN, Illumina",210.75,8.17%,"NWL, Newell Brands",20.06,-3.42%
"RCL, Royal Caribbean Group",41.94,7.65%,"AZO, AutoZone",2231.81,-2.60%
"MOS, The Mosaic Company",60.69,6.01%,"LH, LabCorp",232.79999999999998,-2.53%
"WBD, Warner Bros. Discovery",13.52,5.71%,"DOW, Dow Inc.",54.239999999999995,-2.48%
"CCL, Carnival",10.049999999999999,5.35%,"LYB, LyondellBasell",88.25,-2.17%
"APA, APA Corporation",40.31,3.92%,"WBA, Walgreens Boots Alliance",36.769999999999996,-1.79%
"ALGN, Align Technology",261.7,3.75%,"MRNA, Moderna",141.43,-1.63%
