Biggest Gains,Price,% Gain,Biggest Losses,Price؜,% Loss
"NOC, Northrop Grumman",471.61,11.43%,"UAL, United Airlines Holdings",39.78,-4.88%
"LHX, L3Harris",180.20999999999998,9.96%,"DAL, Delta Air Lines",35.28,-4.65%
"HII, Huntington Ingalls Industries",221.44,9.34%,"VLTO, Veralto",74.61,-4.32%
"LMT, Lockheed Martin",436.53000000000003,8.93%,"CCL, Carnival",12.69,-4.30%
"GD, General Dynamics",238.48,8.43%,"AAL, American Airlines Group",12.24,-4.08%
"MOS, Mosaic Company (The)",35.98,6.80%,"SEDG, SolarEdge",119.22,-3.83%
"HAL, Halliburton",41.309999999999995,6.77%,"VFC, VF Corporation",15.65,-3.69%
"MRO, Marathon Oil",26.22,6.63%,"BBWI, Bath & Body Works, Inc.",31.040000000000003,-3.30%
